{
  "schema_version": "paper2-eligibility-source-bundle-v1",
  "bundle_id": "E1001",
  "source_language": "en",
  "source_access_status": "FULL_TEXT",
  "source_spans": [
    {
      "span_id": "s1",
      "text": "We propose a general account of selective attention under limited perceptual capacity. A system allocates processing resources among competing incoming signals, and changing that allocation changes the probability of correct discrimination."
    },
    {
      "span_id": "s2",
      "text": "The claim is intended to apply across tasks that satisfy the stated capacity constraint: holding the signal set fixed, reallocating the limited processing resource changes the response distribution and task accuracy."
    }
  ]
}
