{
  "schema_version": "paper2-eligibility-source-bundle-v1",
  "bundle_id": "E1003",
  "source_language": "en",
  "source_access_status": "FULL_TEXT",
  "source_spans": [
    {
      "span_id": "s1",
      "text": "We compare four image-classification systems on a benchmark named the Working-Memory Challenge and report their benchmark scores. System A reaches 82 percent accuracy and system B reaches 79 percent."
    },
    {
      "span_id": "s2",
      "text": "The benchmark name is used only as an inherited task label. We do not propose what working memory is, what structure it requires, what the score measures about a capacity, or any general mechanism connecting the benchmark to a cognitive process."
    }
  ]
}
